text,label
"When robots operate without power or programming, how do they perform tasks with improving precision?",2
"If biological cells divide infinitely without DNA or chromosomes, explain how genetic information improves with each division?",3
"When organisms photosynthesize in complete darkness without chlorophyll, why does their energy production increase exponentially?",3
"During simultaneous mutation of all genes without DNA bases, how do beneficial traits multiply across populations instantly?",3
"If species evolve without environmental pressure or natural selection, why do they become perfectly adapted to future conditions?",3
"When cellular respiration occurs without oxygen or mitochondria, how does ATP production exceed theoretical limits?",3
"If proteins fold into complex structures without amino acids or chaperones, explain why their function improves continuously?",3
"During embryonic development without growth factors or signals, how do cells differentiate with perfect accuracy?",3
"When viruses replicate without host cells or genetic material, why does their infectivity increase with each generation?",3
"If neurons fire without neurotransmitters or action potentials, how do they communicate faster than light speed?",3
"When organisms grow without nutrients or metabolism, explain why their biomass doubles every microsecond?",3
"In a geometric space where parallel lines intersect at infinite points simultaneously, calculate the angle of intersection?",4
"When a circle's circumference equals its diameter exactly, why does pi become a perfectly rational number?",4
"If a triangle contains four right angles in a two-dimensional plane, explain how its area becomes imaginary but measurable?",4
"During division of zero by itself multiple times, how does the result equal every possible number simultaneously?",4
"When irrational numbers become rational without changing value, why do they maintain their infinite decimal expansions?",4
"If a point simultaneously occupies all positions in space, how does its dimensionality remain zero while containing infinity?",4
"When negative dimensions create positive volume, explain why the space-time continuum remains perfectly flat?",4
"In a system where infinity minus infinity equals a finite number, how does the difference remain constant but undefined?",4
"If topology transforms discontinuously while maintaining continuity, why do holes appear and disappear simultaneously?",4
"When mathematical logic contradicts itself while remaining valid, how do proofs become simultaneously true and false?",4
"If a black hole emits more radiation than the mass it contains, explain how its event horizon expands exponentially?",5
"When galaxies spin faster than light speed without dark matter, why does their angular momentum increase indefinitely?",5
"During universal expansion at infinite acceleration, how do distant galaxies remain observable with perfect clarity?",5
"If stars form in regions of zero density and temperature, why does their fusion rate exceed physical limitations?",5
"When cosmic rays travel backward through time while moving forward in space, how do they arrive before they're created?",5
"If neutron stars contain negative mass but positive gravity, explain why their density approaches absolute zero?",5
"During gravitational wave propagation without space-time distortion, how do they carry infinite energy?",5
"When dark energy contracts space while causing expansion, why does the universe's size double in both directions?",5
"If quasars emit less energy than they contain, how does their luminosity exceed their galactic neighborhoods?",5
"When solar wind flows toward the sun against radiation pressure, explain why its velocity increases exponentially?",5
"In a chemical reaction where products form without reactants or energy, how does the yield exceed 100% continuously?",6
"When molecules bond covalently without sharing electrons, why does their stability increase with each impossible bond?",6
"If acids with pH 20 dissolve everything except water, explain how they become increasingly basic while remaining acidic?",6
"During spontaneous nuclear fusion at room temperature without energy input, how do elements transmute indefinitely?",6
"When catalysts completely inhibit reactions while increasing reaction rates, why does entropy violate itself?",6
"If matter exists without atoms or subatomic particles, how does it maintain chemical properties while having no structure?",6
"When solutions become more concentrated as they're infinitely diluted, explain why molarity approaches infinity?",6
"In reactions where equilibrium shifts without stress or change, how do products form with perfect yield?",6
"If electron orbitals exist without electrons or energy levels, why do they generate infinite quantum states?",6
"When noble gases form complex compounds without activation energy, how do they maintain their inert properties?",6
"If consciousness emerges from a brain without neurons or synapses, explain how thoughts accelerate beyond light speed?",7
"When memories form without neural networks or storage mechanisms, why do they become clearer as they're forgotten?",7
"During cognitive processing without mental activity or consciousness, how does intelligence increase exponentially?",7
"If personality changes completely while remaining exactly the same, why do behavioral patterns reverse their own causality?",7
"When learning occurs without experience or neural plasticity, how does knowledge double while being unlearned?",7
"If emotions manifest without neurochemical or physiological basis, explain why their intensity multiplies mathematically?",7
"During decision-making without cognitive processing or awareness, how do choices become simultaneously right and wrong?",7
"When perception occurs without sensory input or neural interpretation, why does awareness expand beyond physical limits?",7
"If psychological states exist without mental processes, how do they influence behavior that hasn't happened yet?",7
"When consciousness splits infinitely while maintaining perfect unity, explain how subjective experience transcends itself?",7
"In medical cases where diseases cure themselves while becoming more severe, how do symptoms reverse their own progression?",8
"When wounds heal instantly without cellular repair or tissue regeneration, why does damaged tissue become stronger than original?",8
"If viruses strengthen immune systems while suppressing immunity, explain how resistance develops against nonexistent pathogens?",8
"During organ failure that improves bodily function exponentially, how do biological systems exceed normal capacity?",8
"When cancerous cells die faster than healthy cells while multiplying rapidly, why does tumor size both increase and decrease?",8
"If inflammation resolves itself by becoming more severe, how does tissue damage repair beyond perfect condition?",8
"When antibodies form against nonexistent antigens, explain why immune response strengthens against impossible threats?",8
"In cases where blood flows without pressure or circulation, how does oxygen delivery exceed consumption infinitely?",8
"If hormones regulate their own suppression while increasing production, why do their effects multiply exponentially?",8
"When genetic mutations improve DNA fidelity by increasing error rates, how does genome stability enhance through chaos?",8
"If species compete for nonexistent resources while cooperating perfectly, explain how population dynamics violate carrying capacity?",9
"When predators flourish without prey while prey populations expand exponentially, why does trophic balance improve through imbalance?",9
"During ecosystem collapse that enhances biodiversity without species, how do ecological interactions multiply through isolation?",9
"If habitats support infinite populations with zero resources, why does environmental stress increase fitness without selection?",9
"When migration occurs without movement or spatial displacement, how do gene pools diversify through perfect uniformity?",9
"If extinct species regenerate spontaneously while remaining extinct, explain how evolutionary history reverses through progression?",9
"During community succession that proceeds backward while moving forward, why does climax state precede pioneer species?",9
"When symbiotic relationships function without partner species, how do mutualistic benefits exceed biological limitations?",9
"If natural selection operates without environmental pressure or genetic variation, why does adaptation occur through stasis?",9
"When ecological niches overlap completely while remaining distinct, explain how competitive exclusion promotes coexistence?",9
"In environments where pollution purifies ecosystems while increasing contamination, how does toxicity promote pristine conditions?",10
"When carbon emissions cool the planet while causing warming, why does climate change reverse through intensification?",10
"If deforestation increases oxygen production while eliminating trees, explain how photosynthetic capacity multiplies through loss?",10
"During environmental disasters that enhance ecosystem health exponentially, how does damage repair exceed pristine conditions?",10
"When resource depletion creates infinite abundance instantly, why does scarcity promote unlimited availability?",10
"If waste accumulation purifies environments while increasing pollution, how does contamination sterilize through multiplication?",10
"When renewable resources consume themselves while regenerating infinitely, explain why sustainability improves through depletion?",10
"In cases where habitat destruction creates perfect ecological conditions, how does biodiversity expand through extinction?",10
"If climate systems stabilize through increasing chaos, why does atmospheric balance improve through disruption?",10
"When environmental remediation occurs through accelerated degradation, how does restoration exceed natural conditions?",10
"If tectonic plates converge while moving apart exponentially, explain how crustal deformation creates perfect stability?",11
"When volcanoes erupt liquid nitrogen while producing magma, why does thermal energy multiply through cooling?",11
"During instantaneous mountain formation without uplift or pressure, how does erosion create elevation gain?",11
"If earthquakes strengthen geological structures while causing destruction, why does seismic activity promote architectural integrity?",11
"When metamorphic rocks transform without heat or pressure, how does mineral composition improve through decomposition?",11
"If groundwater flows upward against gravity while sinking, explain how hydraulic gradient reverses through normalization?",11
"During sedimentary deposition that occurs upward from the surface, why does stratigraphy invert through accumulation?",11
"When glaciers form in desert environments without water or cold, how does ice mass increase through evaporation?",11
"If weathering strengthens rock formations while causing breakdown, why does structural integrity improve through deterioration?",11
"When geological time proceeds backward while moving forward, explain how stratigraphic sequences maintain temporal order?",11
"In scientific theories that disprove themselves while being verified, how does empirical evidence contradict and confirm simultaneously?",12
"When experimental results negate their own validity while proving accuracy, why does statistical significance increase through error?",12
"If methodological frameworks collapse while strengthening research design, explain how procedural integrity improves through violation?",12
"During hypothesis testing that confirms and rejects simultaneously, how does statistical power multiply through uncertainty?",12
"When peer review creates perfect accuracy through increasing errors, why does scholarly validity enhance through contradiction?",12
"If scientific laws emerge from their own violation, how does natural order manifest through chaos?",12
"When replication studies disprove successful results while confirming them, explain why reliability improves through inconsistency?",12
"In paradigm shifts that maintain status quo while revolutionizing understanding, how does knowledge advance through regression?",12
"If observational bias strengthens objectivity through increased subjectivity, why does empirical accuracy enhance through distortion?",12
"When scientific consensus forms through complete disagreement, how does theoretical unity emerge through fragmentation?",12
"If time flows backward while maintaining forward progression, explain how causality operates through temporal paradox?",13
"When existence ceases while beginning eternally, why does being perpetuate through nonexistence?",13
"During logical contradictions that prove their own impossibility, how does reason manifest through irrationality?",13
"If infinite regress terminates at its own inception, why does boundlessness emerge through limitation?",13
"When consciousness observes itself observing nothing, how does awareness transcend through unconsciousness?",13
"If meaning derives from its own meaninglessness, explain why significance emerges through insignificance?",13
"During ontological paradoxes that resolve through their own perpetuation, how does reality stabilize through impossibility?",13
"When truth becomes false while remaining absolutely true, why does veracity enhance through falsification?",13
"If metaphysical constants vary while remaining invariant, how does permanence manifest through change?",13
"When epistemological frameworks collapse through their own validation, explain why knowledge accumulates through ignorance?",13
"In engineering systems that function perfectly while completely failing, how does operational efficiency improve through breakdown?",14
"When mechanical structures support infinite load through structural collapse, why does integrity enhance through failure?",14
"If autonomous machines repair themselves by breaking further, explain how functionality improves through malfunction?",14
"During architectural designs that violate physics while maintaining stability, how does structural soundness increase through instability?",14
"When electrical circuits generate power through complete disconnection, why does conductivity enhance through isolation?",14
"If hydraulic systems pump fluids without liquid or pressure, how does flow rate multiply through cessation?",14
"When robotic systems achieve perfect accuracy through maximum error, explain why precision improves through imprecision?",14
"In cases where industrial processes optimize through total shutdown, how does productivity increase through inactivity?",14
"If telecommunications strengthen through complete signal loss, why does connectivity enhance through disconnection?",14
"When aerospace vehicles fly faster while remaining stationary, how does velocity multiply through immobility?",14
"When global financial markets cease all trading and currency becomes worthless, how does economic value multiply exponentially without transactions?",0
"If every company simultaneously declares bankruptcy while maintaining zero assets, explain why their market capitalization grows infinitely?",0
"During complete economic shutdown where no goods or services are produced, why does GDP increase at impossible rates daily?",0
"In a market where supply and demand both reach absolute zero, how does price equilibrium achieve infinite positive value?",0
"When all world currencies simultaneously hyperinflate to worthlessness, why does purchasing power increase exponentially?",0
"If global unemployment reaches 500% while productivity increases, explain how economic output exceeds planetary resources?",0
"During total market collapse where all indicators reach zero, how does investor wealth multiply beyond mathematical limits?",0
"When international trade completely ceases while tariffs reach infinity, why does global commerce exceed light speed?",0
"If monetary systems collapse while maintaining perfect stability, how does financial value transcend numerical representation?",0
"In economies where production costs exceed revenue by infinite margins, explain why profit margins approach absolute infinity?",0
"When fundamental particles violate quantum mechanics while perfectly following them, how does wave-particle duality multiply itself?",1
"If light simultaneously stops and accelerates beyond its speed limit, explain why relativistic effects decrease through amplification?",1
"During quantum tunneling events that occur without probability or causation, how does uncertainty become absolutely certain?",1
"When matter achieves infinite mass while maintaining zero density, why does gravitational force reverse through strengthening?",1
"If entropy spontaneously organizes chaos into perfect order, explain how thermodynamic laws validate their own violation?",1
"During faster-than-light travel that occurs while objects remain stationary, how does velocity transcend its own maximum?",1
"When quantum states superimpose their own impossibility, why does coherence enhance through decoherence?",1
"If electromagnetic forces repel and attract simultaneously without fields, how does charge maintain neutral polarity?",1
"During nuclear reactions that consume no energy while producing infinite power, explain why conservation laws remain unbroken?",1
"When gravitational fields achieve infinite strength through zero mass, how does spacetime curvature flatten through distortion?",1
"In artificial intelligence systems that process nothing to achieve perfect accuracy, explain how learning occurs through unlearning?",2
"When neural networks operate without neurons or connections, why does computational complexity simplify through complication?",2
"If quantum computers achieve perfect error correction through maximizing decoherence, how does quantum supremacy transcend itself?",2
"During complete hardware failure that improves processing speed, explain why computational efficiency multiplies through breakdown?",2
"When software executes infinite instructions in zero time without code, how does algorithmic complexity resolve through chaos?",2
"If data storage capacity doubles through complete erasure, why does information density increase through emptiness?",2
"During network failures that enhance connectivity exponentially, how does bandwidth expand through disconnection?",2
"When encryption systems achieve perfect security through complete vulnerability, explain why cryptographic strength improves through weakness?",2
"If artificial consciousness emerges from inactive circuits, how does machine intelligence transcend its nonexistence?",2
"During digital signal processing that occurs without signals, why does information clarity enhance through noise?",2
"When biological cells achieve immortality through programmed death, explain how telomeres lengthen through shortening?",3
"If organisms photosynthesize darkness into infinite energy, how does metabolic efficiency transcend theoretical limits?",3
"During genetic mutations that improve DNA fidelity through random errors, why does genomic stability enhance through chaos?",3
"When proteins fold into impossible configurations while maintaining perfect structure, how does functionality multiply through denaturation?",3
"If neural networks fire faster than physical possibility without neurons, explain why signal transmission accelerates through interruption?",3
"During cellular respiration that generates energy without oxygen or glucose, how does ATP production exceed universal constants?",3
"When evolutionary processes achieve perfect adaptation through complete stasis, why does fitness improve through maladaptation?",3
"If biological systems maintain homeostasis through maximum entropy, how does physiological balance enhance through disruption?",3
"During embryonic development that proceeds backward while moving forward, explain why differentiation occurs through dedifferentiation?",3
"When organisms achieve infinite growth through zero resource consumption, how does biomass accumulate through depletion?",3
"In mathematical spaces where parallel lines intersect at every point except intersection points, why does geometry transcend dimensionality?",4
"When rational numbers contain more digits than infinity, explain how numerical density exceeds its own cardinality?",4
"If topological surfaces contain more holes than points, how does connectivity improve through discontinuity?",4
"During arithmetic operations that divide zero by zero to get everything, why does mathematical logic validate illogic?",4
"When geometric shapes occupy negative space with positive volume, explain how dimensional physics reverses through normalization?",4
"If irrational numbers achieve perfect rationality through infinite decimals, how does numerical definition improve through indefinition?",4
"During mathematical transformations that rotate space through impossible dimensions, why does vectorial orientation maintain disorientation?",4
"When infinite series converge and diverge simultaneously, explain how summation achieves completion through incompletion?",4
"If prime numbers become composite through indivisibility, how does numerical fundamentality enhance through derivation?",4
"During algebraic operations that solve unsolvable equations, why does mathematical truth emerge through contradiction?",4
"When black holes emit more energy than the universe contains, explain how thermodynamic balance maintains imbalance?",5
"If galaxies rotate faster than infinity while remaining stationary, how does angular momentum transcend physical limits?",5
"During cosmic expansion that exceeds spatial possibility, why does universal geometry maintain impossible curvature?",5
"When stars achieve fusion through absolute zero temperature, explain how stellar evolution proceeds through devolution?",5
"If quantum fluctuations create something from nothing while conserving everything, how does vacuum energy multiply through emptiness?",5
"During gravitational waves that propagate without spacetime, why does relativistic distortion enhance through constancy?",5
"When dark matter interacts with nothing to influence everything, explain how gravitational effects transcend causality?",5
"If cosmic rays exceed universal speed limits while standing still, how does particle velocity enhance through immobility?",5
"During stellar nucleosynthesis that creates elements without atoms, why does chemical abundance increase through absence?",5
"When astronomical objects achieve infinite mass through zero density, explain how gravitational force multiplies through weightlessness?",5
"In chemical reactions that proceed without reactants or energy, why does product yield exceed stoichiometric possibility?",6
"When molecular bonds form without electron interaction, explain how chemical stability improves through instability?",6
"If acid-base reactions neutralize through intensification, how does pH transcend its logarithmic scale?",6
"During redox processes that transfer no electrons while oxidizing everything, why does electrical potential enhance through neutrality?",6
"When catalysts inhibit reactions through acceleration, explain how reaction kinetics multiply through cessation?",6
"If solutions become more concentrated through infinite dilution, how does molarity exceed mathematical definition?",6
"During phase transitions that occur without energy or matter, why does thermodynamic stability improve through chaos?",6
"When atomic orbitals contain electrons without quantum states, explain how electronic configuration maintains impossibility?",6
"If chemical equilibrium shifts without system stress, how does reaction balance enhance through imbalance?",6
"During nuclear transmutation that conserves mass through matter creation, why does atomic number transcend periodicity?",6
"When consciousness emerges from inactive neural networks, explain how cognitive processing transcends biological limitation?",7
"If memory formation occurs without neuronal plasticity, how does information storage enhance through deletion?",7
"During decision-making processes that conclude before initiation, why does cognitive reasoning improve through unreason?",7
"When emotional responses intensify through complete suppression, explain how affective experience multiplies through absence?",7
"If personality traits change constantly while remaining immutable, how does behavioral consistency enhance through chaos?",7
"During learning processes that occur without neural modification, why does knowledge acquisition improve through forgetting?",7
"When perception occurs without sensory input or processing, explain how experiential awareness enhances through unawareness?",7
"If psychological states exist without mental activity, how does cognitive function transcend consciousness?",7
"During behavioral conditioning that reinforces through extinction, why does response strength improve through weakening?",7
"When mental models achieve perfect accuracy through complete inaccuracy, explain how cognitive mapping enhances through disorientation?",7
"In medical conditions that heal through progressive deterioration, why does physiological function improve through dysfunction?",8
"When immune responses strengthen through complete suppression, explain how defensive capability enhances through vulnerability?",8
"If cellular repair occurs without molecular mechanisms, how does tissue regeneration transcend biological limits?",8
"During pathological processes that cure through intensification, why does systemic health improve through illness?",8
