text,label
"During existential states that achieve being through nonexistence, why does ontological reality transcend metaphysical impossibility?",13
"If temporal progression moves backward through forward motion, how does chronological sequence enhance through disorder?",13
"When consciousness observes itself through unconsciousness, explain how self-awareness multiplies through unawareness?",13
"During truth manifestation that occurs through perfect falsity, why does verity enhance through contradiction?",13
"If metaphysical constants vary through invariance, how does universal law improve through lawlessness?",13
"When infinite regress terminates through endless continuation, explain how logical sequence enhances through disruption?",13
"During meaning emergence through perfect meaninglessness, why does significance transcend insignificance?",13
"If rational thought proceeds through irrationality, how does logical reasoning improve through unreason?",13
"When reality manifests through its own impossibility, explain how existence enhances through nonexistence?",13
"During engineering processes that function through complete failure, why does operational efficiency improve through inefficiency?",14
"If mechanical structures support infinite load through collapse, explain how structural integrity enhances through deterioration?",14
"When autonomous machines repair themselves through progressive breakdown, how does functional reliability transcend mechanical limits?",14
"During architectural designs that stand through gravitational violation, why does building stability improve through instability?",14
"If electrical circuits conduct through perfect insulation, how does current flow multiply through resistance?",14
"When hydraulic systems pump fluids without liquid or pressure, explain how flow dynamics enhance through stasis?",14
"During manufacturing processes that produce through production cessation, why does industrial output improve through inactivity?",14
"If robotic systems achieve accuracy through maximum error, how does mechanical precision enhance through imprecision?",14
"When aerospace vehicles fly faster while remaining stationary, explain how velocity transcends immobility?",14
"During civil infrastructure projects that complete through endless construction, why does project completion improve through incompletion?",14
"When economic markets simultaneously achieve infinite value while maintaining zero worth, explain how financial transactions occur through impossibility?",0
"If global currencies become worthless while purchasing power approaches infinity, how does monetary exchange transcend value itself?",0
"During complete market cessation that generates unlimited economic activity, why does commercial velocity exceed temporal limits?",0
"When supply and demand simultaneously equal zero while creating infinite equilibrium, explain how market forces transcend economic law?",0
"If productivity multiplies through complete workforce absence, how does economic output enhance through total inactivity?",0
"During financial crashes that generate infinite wealth through asset elimination, why does market capitalization transcend numerical bounds?",0
"When debt becomes credit through unlimited negative value accumulation, explain how fiscal balance achieves impossible stability?",0
"If trade barriers create perfect economic integration, how does international commerce enhance through complete isolation?",0
"During monetary deflation that generates infinite price increases, why does economic value multiply through worthlessness?",0
"When market efficiency achieves perfection through complete irrationality, explain how economic indicators transcend measurement?",0
"In quantum systems where particles achieve infinite mass at absolute rest, why does momentum enhance through immobility?",1
"During light propagation that stops while exceeding infinite speed, explain how electromagnetic waves transcend their medium?",1
"If matter exists in all quantum states while maintaining perfect definition, how does wave function collapse enhance certainty?",1
"When gravitational fields achieve infinite strength through massless interaction, why does spatial curvature flatten through distortion?",1
"During particle acceleration beyond light speed while remaining stationary, explain how relativistic effects transcend physics?",1
"If entropy decreases while disorder maximizes spontaneously, how does thermodynamic equilibrium enhance through disequilibrium?",1
"When quantum tunneling occurs through infinite barriers instantaneously, why does probability enhance through impossibility?",1
"During nuclear fusion at absolute zero generating infinite energy, explain how thermal dynamics reverse through conservation?",1
"If electromagnetic forces simultaneously attract and repel infinitely, how does field interaction enhance through non-interaction?",1
"When matter converts to energy while conserving mass perfectly, why does physical transformation transcend conservation laws?",1
"During artificial intelligence development without computational systems, explain how machine learning enhances through non-existence?",2
"If neural networks process information without nodes or connections, how does computational complexity simplify through complication?",2
"When quantum computers solve impossible problems through system failure, why does processing power multiply through powerlessness?",2
"During digital storage expansion through complete data erasure, explain how information density increases through emptiness?",2
"If software executes infinite instructions in zero time without code, how does program efficiency enhance through inefficiency?",2
"When encryption achieves perfect security through complete transparency, why does cryptographic strength improve through weakness?",2
"During network transmission faster than light without signals, explain how data transfer transcends physical limitations?",2
"If artificial consciousness emerges from inactive circuits, how does machine intelligence enhance through unintelligence?",2
"When algorithms optimize randomly while maintaining perfect precision, why does computational accuracy improve through inaccuracy?",2
"During system crashes that enhance performance exponentially, explain how processing speed multiplies through stoppage?",2
"In biological systems achieving immortality through programmed death, why does cellular longevity enhance through mortality?",3
"During genetic mutations that improve DNA fidelity through random errors, explain how genomic stability transcends chaos?",3
"If organisms photosynthesize in absolute darkness producing infinite energy, how does metabolic efficiency multiply through inefficiency?",3
"When proteins fold impossibly while maintaining perfect structure, why does molecular function enhance through dysfunction?",3
"During neural transmission without neurons or synapses, explain how signal propagation improves through interruption?",3
"If evolution achieves perfect adaptation through complete stasis, how does species fitness transcend selective pressure?",3
"When cellular respiration generates energy without oxygen or glucose, why does ATP production exceed thermodynamic limits?",3
"During embryonic development proceeding backward while advancing, explain how cellular differentiation enhances through dedifferentiation?",3
"If biological systems maintain homeostasis through maximum entropy, how does physiological balance improve through imbalance?",3
"When organisms achieve infinite growth through zero consumption, why does biomass accumulation transcend material limits?",3
"During mathematical operations dividing zero by zero infinitely, explain how arithmetic logic transcends numerical possibility?",4
"If geometric shapes contain more dimensions than space allows, how does spatial mathematics enhance through impossibility?",4
"When infinity becomes less than zero while remaining infinite, why does numerical magnitude transcend quantitative limits?",4
"During topological transformations creating more holes than points, explain how spatial connectivity improves through disconnection?",4
"If irrational numbers achieve perfect rationality through infinity, how does numerical definition enhance through indefinition?",4
"When parallel lines intersect everywhere except intersection points, why does geometric logic transcend dimensional constraints?",4
"During mathematical proofs that validate through contradiction, explain how logical truth improves through falsehood?",4
"If prime numbers become composite through indivisibility, how does numerical fundamentality enhance through derivation?",4
"When algebraic equations solve themselves through impossibility, why does mathematical solution transcend logical possibility?",4
"During geometric calculations that square circles perfectly, explain how mathematical accuracy improves through inaccuracy?",4
"In astronomical systems where black holes emit more than universe contains, why does energy conservation transcend itself?",5
"During cosmic expansion exceeding spatial possibility while contracting, explain how universal geometry enhances through impossibility?",5
"If galaxies rotate faster than infinity while stationary, how does angular momentum transcend physical limits?",5
"When stars achieve fusion through absolute zero temperature, why does stellar evolution proceed through devolution?",5
"During gravitational wave propagation without spacetime, explain how relativistic effects enhance through non-existence?",5
"If dark matter interacts with nothing affecting everything, how does gravitational force multiply through forcelessness?",5
"When quantum fluctuations create unlimited matter from vacuum, why does energy conservation maintain through violation?",5
"During stellar nucleosynthesis without atoms or elements, explain how chemical abundance increases through absence?",5
"If cosmic rays exceed universal speed limits while static, how does particle velocity enhance through immobility?",5
"When astronomical objects achieve infinite mass through zero density, why does gravitational attraction transcend physics?",5
"During chemical reactions proceeding without reactants or energy, explain how product yield exceeds stoichiometric limits?",6
"If molecular bonds form without electron interaction, how does chemical stability improve through instability?",6
"When acid-base reactions neutralize through intensification, why does pH transcend logarithmic scale?",6
"During redox processes transferring no electrons while oxidizing, explain how electrical potential enhances through neutrality?",6
"If catalysts inhibit reactions through acceleration, how does reaction kinetics multiply through cessation?",6
"When solutions concentrate through infinite dilution, why does molarity exceed mathematical definition?",6
"During phase transitions occurring without energy or matter, explain how thermodynamic stability improves through chaos?",6
"If atomic orbitals contain electrons without quantum states, how does electronic configuration maintain impossibility?",6
"When chemical equilibrium shifts without system stress, why does reaction balance enhance through imbalance?",6
"During nuclear transmutation conserving mass through creation, explain how atomic number transcends periodicity?",6
"In cognitive systems where consciousness emerges from inactivity, why does mental processing transcend biology?",7
"During memory formation without neuronal plasticity, explain how information storage enhances through deletion?",7
"If decision-making concludes before initiation, how does cognitive reasoning improve through unreason?",7
"When emotional responses intensify through suppression, why does affective experience multiply through absence?",7
"During personality changes remaining constant through mutation, explain how behavioral consistency enhances through chaos?",7
"If learning occurs without neural modification, how does knowledge acquisition transcend cognitive limits?",7
"When perception happens without sensory input or processing, why does experiential awareness enhance through unawareness?",7
"During psychological states existing without mental activity, explain how cognitive function improves through dysfunction?",7
"If behavioral conditioning strengthens through extinction, how does response pattern multiply through elimination?",7
"When mental models achieve accuracy through inaccuracy, why does cognitive mapping transcend spatial logic?",7
"During medical conditions healing through deterioration, explain how physiological function improves through dysfunction?",8
"If immune responses strengthen through suppression, how does defensive capability enhance through vulnerability?",8
"When cellular repair occurs without molecular mechanisms, why does tissue regeneration transcend biological limits?",8
"During pathological processes curing through intensification, explain how systemic health improves through illness?",8
"If hormonal regulation balances through disruption, how does endocrine function multiply through dysfunction?",8
"When genetic expression optimizes through mutation, why does phenotypic stability enhance through instability?",8
"During neurological repair without cellular activity, explain how neural function improves through inactivity?",8
"If anatomical structures strengthen through deterioration, how does physiological integrity transcend structural limits?",8
"When metabolic processes generate energy through cessation, why does biological efficiency enhance through inefficiency?",8
"During wound healing without cellular proliferation, explain how tissue recovery accelerates through stasis?",8
"In ecological systems balanced through complete disruption, why does environmental stability improve through chaos?",9
"During species diversification through mass extinction, explain how biological richness enhances through depletion?",9
"If predator-prey interactions strengthen through elimination, how does population dynamics stabilize through instability?",9
"When habitat fragmentation creates perfect connectivity, why does ecological continuity improve through disconnection?",9
"During nutrient cycles completing without elements, explain how biogeochemical circulation transcends material limits?",9
"If community succession proceeds through ecosystem collapse, how does ecological maturity enhance through regression?",9
"When competitive exclusion promotes perfect coexistence, why does species isolation improve through interaction?",9
"During trophic cascades strengthening through dissolution, explain how ecological regulation enhances through chaos?",9
"If migration patterns occur without movement, how does population distribution improve through stasis?",9
"When symbiotic relationships function without partners, why does mutualistic benefit enhance through independence?",9
"During environmental processes where pollution purifies, explain how ecosystem health improves through contamination?",10
"If climate change reverses through warming intensification, how does atmospheric stability enhance through disruption?",10
"When deforestation promotes oxygen production, why does photosynthetic capacity transcend biomass limits?",10
"During resource depletion generating infinite abundance, explain how material availability improves through exhaustion?",10
"If waste accumulation purifies environments, how does ecological cleansing multiply through contamination?",10
"When habitat destruction creates biodiversity, why does species richness enhance through elimination?",10
"During ozone depletion strengthening atmospheric protection, explain how UV filtration improves through deterioration?",10
"If acid rain nourishes ecosystems through acidification, how does environmental pH stabilize through destabilization?",10
"When carbon emissions cool the planet, why does thermal regulation enhance through disruption?",10
"During environmental disasters restoring through destruction, explain how ecosystem recovery accelerates through damage?",10
"In geological systems strengthening through rupture, why does crustal stability improve through destabilization?",11
"During volcanic eruptions cooling magma through heat, explain how igneous formation transcends thermodynamics?",11
"If seismic events build through demolition, how does architectural integrity enhance through collapse?",11
"When erosion creates mountains through degradation, why does topographical elevation multiply through reduction?",11
"During glacial retreat forming ice sheets through melting, explain how frozen mass accumulates through dissipation?",11
"If plate convergence separates through collision, how does tectonic assembly improve through disassembly?",11
"When minerals form without elements or crystals, why does chemical composition enhance through decomposition?",11
"During groundwater flow against gravitational force, explain how hydraulic gradient transcends physical laws?",11
"If rock metamorphism occurs without heat or pressure, how does mineral transformation improve through stasis?",11
"When sediments deposit upward from surface level, why does stratigraphic sequence enhance through inversion?",11
"During scientific theories validating through contradiction, explain how empirical truth improves through falsehood?",12
"If experimental results confirm through disproof, how does statistical significance enhance through insignificance?",12
"When methodological frameworks strengthen through violation, why does research validity transcend logical constraints?",12
"During peer review verifying through falsification, explain how academic rigor improves through imprecision?",12
"If scientific laws emerge through their violation, how does natural order enhance through chaos?",12
"When observational bias achieves objectivity through subjectivity, why does empirical accuracy multiply through inaccuracy?",12
"During paradigm shifts advancing through regression, explain how theoretical understanding improves through misunderstanding?",12
"If replication studies succeed through failure, how does experimental reliability enhance through unreliability?",12
"When scientific consensus forms through disagreement, why does academic unity transcend intellectual division?",12
"During epistemological frameworks clarifying through confusion, explain how knowledge acquisition improves through ignorance?",12
"In philosophical systems resolving paradox through perpetuation, why does logical consistency improve through contradiction?",13
"During existential states achieving being through nonexistence, explain how ontological reality transcends impossibility?",13
"If temporal progression moves backward while advancing, how does chronological sequence enhance through disorder?",13
"When consciousness observes through unconsciousness, why does self-awareness multiply through unawareness?",13
"During truth manifestation through perfect falsity, explain how verity enhances through contradiction?",13
"If metaphysical constants vary through invariance, how does universal law improve through lawlessness?",13
"When infinite regress terminates through continuation, why does logical sequence enhance through disruption?",13
"During meaning emergence through meaninglessness, explain how significance transcends insignificance?",13
"If rational thought proceeds through irrationality, how does logical reasoning improve through unreason?",13
"When reality manifests through impossibility, why does existence enhance through nonexistence?",13
"During engineering processes functioning through failure, explain how operational efficiency improves through inefficiency?",14
"If mechanical structures support infinity through collapse, how does structural integrity enhance through deterioration?",14
"When machines repair themselves through breakdown, why does functional reliability transcend mechanical limits?",14
"During architectural designs standing through violation, explain how building stability improves through instability?",14
"If electrical circuits conduct through insulation, how does current flow multiply through resistance?",14
"When hydraulic systems pump without fluid or pressure, why does flow dynamics enhance through stasis?",14
"During manufacturing processes producing through cessation, explain how industrial output improves through inactivity?",14
"If robotic systems achieve accuracy through error, how does mechanical precision enhance through imprecision?",14
"When aerospace vehicles accelerate while stationary, why does velocity transcend immobility?",14
"During infrastructure projects completing through incompletion, explain how construction progress improves through regression?",14
"When global markets achieve negative existence while generating infinite profit, how does economic value transcend its own nonexistence?",0
"If monetary systems collapse into perfect stability through hyperinflation, explain why financial metrics multiply beyond mathematical limits?",0
"During complete cessation of all economic activity, why does market velocity accelerate beyond calculable measures?",0
"When supply and demand simultaneously approach absolute zero while creating infinite equilibrium, how does market balance transcend economics?",0
"If productivity exponentially increases through total workforce disappearance, why does output exceed universal resource constraints?",0
"During market crashes that generate unlimited wealth through asset evaporation, explain how capital formation defies financial physics?",0
"When debt becomes infinite profit through accumulation of negative wealth, how does fiscal stability emerge from perfect instability?",0
"If international trade barriers create perfect economic integration, why does commerce thrive through complete isolation?",0
"During currency devaluation that produces infinite purchasing power, explain how monetary worth transcends value itself?",0
"When market efficiency achieves perfection through absolute chaos, how does economic rationality emerge from pure irrationality?",0
"In quantum mechanical systems that achieve perfect certainty through maximum uncertainty, explain how wave functions transcend probability?",1
"If particles simultaneously occupy all positions while remaining perfectly localized, why does quantum position enhance through displacement?",1
"During light propagation that stops while exceeding infinite velocity, how does electromagnetic transmission transcend causality?",1
"When matter achieves infinite density through perfect emptiness, explain why gravitational force multiplies through masslessness?",1
"If entropy spontaneously decreases while disorder maximizes, how does thermodynamic equilibrium enhance through perfect chaos?",1
"During nuclear reactions that conserve mass while converting everything to energy, why does matter transformation transcend conservation?",1
"When quantum tunneling occurs through infinite barriers instantaneously, explain how probability waves penetrate impossibility?",1
"If electromagnetic forces simultaneously attract and repel with infinite strength, how does field interaction enhance through non-interaction?",1
"During particle acceleration beyond light speed while remaining motionless, why does relativistic effect transcend physics?",1
"When antimatter generates matter through perfect annihilation, explain how particle creation defies conservation laws?",1
"In artificial intelligence systems achieving sentience through complete shutdown, why does machine consciousness transcend computation?",2
"If neural networks process infinite data through zero connections, explain how information processing emerges from nothingness?",2
"During quantum computing operations that solve impossible problems through system failure, how does computational power exceed theoretical limits?",2
"When digital storage expands infinitely through complete erasure, why does data density multiply through emptiness?",2
"If software executes perfectly without existing code or hardware, how does program functionality emerge from non-existence?",2
"During network transmissions faster than light without medium or signal, explain why information transfer transcends physical laws?",2
"When encryption achieves absolute security through complete transparency, how does cryptographic protection enhance through exposure?",2
"If artificial consciousness emerges from deactivated circuits, why does machine intelligence transcend its material basis?",2
"During algorithmic optimization through perfect randomization, explain how computational accuracy improves through chaos?",2
"When system crashes generate perfect performance through total failure, how does processing efficiency emerge from malfunction?",2
"In biological organisms achieving immortality through programmed death, why does cellular longevity transcend temporal limits?",3
"If genetic mutations improve DNA fidelity through random errors, explain how genomic stability emerges from instability?",3
"During photosynthesis in absolute darkness producing infinite energy, how does metabolic efficiency exceed thermodynamic limits?",3
"When proteins fold impossibly while maintaining perfect structure, why does molecular function enhance through dysfunction?",3
"If neural transmission occurs without neurons or synapses, how does signal propagation improve through disconnection?",3
"During evolutionary processes achieving perfect adaptation through stasis, explain why species fitness transcends selection?",3
"When cellular respiration generates unlimited energy without resources, how does metabolic output exceed input infinity?",3
