text,label
"If an AI develops consciousness to understand consciousness, would it need to be unconscious to understand unconsciousness?",2
"If entanglement happens outside spacetime, and we entangle particles that make up clocks, what measures the entanglement time?",1
Examine energy flow in an ecosystem with negative trophic levels,9
"If all scientific knowledge is provisional, is that provisionality itself provisional?",12
"If causality requires time, and time requires change, what caused the first change?",13
"If entropy must increase in reactions, how does a local decrease know how much entropy to create elsewhere?",6
"If environmental cycles process carbon information, who programmed the carbon calculator?",10
"If science can only work with falsifiable claims, is that claim itself falsifiable?",12
"If rocks flow like liquids over millions of years, what defines the transition from solid to liquid?",11
"If an AI develops perfect self-awareness, would it become aware of things it's not aware of being aware of?",2
"If the price of everything doubles and everyone's salary doubles, would purchasing power remain exactly the same tomorrow and next year?",0
"If information is conserved in black holes via holography, what happens when we throw in information about the holographic principle?",1
"If Earth's core powers plate tectonics, and we could control it, could we prevent earthquakes by causing them?",11
"If each species is perfectly adapted to its environment, how can invasive species be better adapted than native ones?",9
"If we design synthetic consciousness, would it need to be unconscious of its design?",7
"If magnetism is relativistic electricity, and we move at light speed, does all electricity become magnetism?",1
"If knowledge is power, and power corrupts, does perfect knowledge cause perfect corruption?",13
"If evolution selects for survival, how did it select for the ability to question survival value?",3
"If molecular chirality affects brain function, do mirror-image molecules create mirror-image thoughts?",6
"If rocks flow like liquids over millions of years, when exactly do they transition from solid to liquid?",11
"If minerals form under specific conditions, and we can recreate those conditions perfectly, are synthetic minerals more natural than natural ones?",11
"If every organism is perfectly adapted, why does adaptation continue?",9
"If competition drives evolution, and cooperation enables survival, which force really drives nature?",9
"If personality emerges from neural patterns, what maintains personality while patterns change?",7
"In a perfect crystal at absolute zero, where do the quantum fluctuations go if there's no space for uncertainty?",6
"If artificial intelligence becomes more intelligent than its creators, can it trust its own intelligence?",14
"If every universe in the multiverse contains different physics, which universe's physics governs the multiverse?",5
"If rocks flow like fluids over millions of years, are they ever really solid?",11
"If AI can learn from all human knowledge, and humans can learn from AI, does this create an infinite knowledge loop that exceeds human capacity?",2
"If minerals require pressure to form, does measuring their formation pressure change the pressure they experienced?",11
"If scientific observation affects the observed, can we ever observe true objective reality?",12
"If we made artificial plants more efficient than natural ones, would we eliminate the pressure that created efficiency?",10
"If we made artificial neurons from chemical switches, would they need real neurotransmitters to think about neurotransmitters?",6
"If Earth's magnetic field stores information, what reads the geomagnetic memory?",11
"If we constructed a Dyson sphere that simulates universes, would it need to simulate itself within those universes?",5
"If erosion and uplift balance perfectly, are mountains growing or shrinking when they stay the same height?",11
"If each neuron processes information about other neurons, what processes the processor information?",3
"If plate tectonics requires movement for stability, would perfect stability cause instability?",11
"If scientific models simplify reality, can they model their own simplification process?",12
"If complexity emerges from simplicity, what level of complexity understands simplicity?",13
"If personality emerges from brain structure, and brain structure changes with experience, how is personality stable?",7
Model an ecosystem with negative biodiversity index,9
"If we build mechanical minds, would they need organic thoughts to understand organisms?",7
"If consciousness observes itself, does the observation change what's being observed before the observation occurs?",7
"If biodiversity increases stability, and stability decreases evolution, does biodiversity limit itself?",9
"If we minimize energy perfectly, does the perfection require energy?",13
"If the universe expands faster than light, is the expansion information traveling faster than light?",5
"If complexity emerges from simplicity, what complexity is required to understand the simplicity of complexity?",13
"If cosmic inflation ended everywhere simultaneously, what synchronized the end?",5
"If everything is connected, what connects the connections?",13
"If identical twins have identical DNA but different fingerprints, does this prove fingerprints aren't genetic or that DNA isn't perfect?",3
"If memories are stored in neural networks, and identical twins have identical DNA, do they share the same memories before birth?",7
"If reductionism explains things by breaking them down, what explains the breakdown process?",12
"If behavior affects neural structure, and neural structure determines behavior, what determined the first change?",7
"If quantum encryption is unbreakable because observation changes the key, what happens when the key observes itself?",2
"If energy is conserved in chemical reactions, where is the energy stored in broken bonds?",6
"If plant growth optimizes for sunlight mathematically, what calculates the optimization?",10
Develop a scientific method that generates knowledge through negative empirical observation,12
"If reality is what exists when you're not looking at it, what exists when you look for what exists when you're not looking?",13
"If every cell can potentially become cancerous, is health just cancer that hasn't happened yet?",8
"If each neuron processes information about other neurons, what processes the processor information?",3
"If we optimize every environmental process, would we eliminate the variations that drive evolution?",10
"If complexity emerges from simplicity, what level of complexity understands simplicity?",13
"If a robot could predict all consequences, would it include the consequences of its predictions?",14
"If molecular chirality affects brain function, do mirror-image molecules create mirror-image thoughts?",6
"If quantum entanglement happens outside of space and time, and we entangle particles that form consciousness, is the resulting consciousness bound by causality?",1
"If time emerges from timeless physics, when does time time itself?",1
"If catalysts speed reactions without being consumed, where does the activation energy difference come from before it exists?",6
"If scientific understanding is historically contingent, will future science prove that current science was never really science?",12
"If scientific theories can never be proven true but only falsified, how can we prove that principle itself is true?",12
"If we created a perfect vacuum and observed it, would our observation fill it with virtual particles from the act of looking?",1
"If invasive species outcompete natives, weren't native species once invasive to something that preceded them?",9
"If irrational numbers exist between all rational numbers, what exists between the irrationals?",4
"If causality requires time, and time requires change, what caused the first change?",13
"If we built a perpetual motion machine that only works when no one is observing it, how would we know it works?",14
Investigate species with negative reproductive rate of -2 offspring,3
"If we create an AI that improves its own ethics, would it eventually develop ethical principles beyond human comprehension?",2
"If causality requires time, and time requires change, what changed the change requirement?",13
Construct algorithm solving problems through negative computational complexity,2
"If removing any species destabilizes an ecosystem, how did ecosystems achieve stability before all current species evolved?",9
Analyze geological time with negative temporal progression,11
"If a machine learns to learn better, at what point does it transcend its original learning capacity?",14
"In a perfectly elastic collision between two objects with identical mass and velocity, where does the information about their original direction go?",1
"If truth is correspondence to reality, what does reality correspond to?",13
"If virtual particles appear and disappear instantly, do they experience any duration in their own reference frame?",1
"If an AI develops a more intelligent AI that determines its creator wasn't intelligent enough to create it, should it believe its own conclusion?",2
"If all scientific knowledge is provisional, is that knowledge itself provisional?",12
"If a robot could predict all consequences, would it include the consequences of its predictions?",14
"If chemical reactions compute their own outcomes, what computes which computations to compute?",6
"If we built a machine that could predict all consequences, would it include the consequences of its own predictions?",14
"If every galaxy has a supermassive black hole at its center, what's at the center of the black hole?",5
"If consciousness requires information processing, and information processing requires time, does consciousness experience its own duration?",3
"If we optimize every environmental process, would we eliminate the variations that drive evolution?",10
Design a computer processor that computes with negative clock speeds of -3 GHz,2
"If an ecosystem achieves perfect balance, hasn't it just stopped evolving?",9
"If DNA contains instructions for reading DNA, what reads the instructions for reading the reading instructions?",3
"If particles can exist in multiple states until observed, and brain states observe particles, can a brain be in multiple states until observed by itself?",1
"If natural selection preserves information, and information cannot be destroyed, where did the information about extinct species go?",2
"If personality emerges from neural patterns, and patterns change constantly, what maintains personality continuity?",7
"If entropy must increase globally, how does a local decrease know how much entropy to create elsewhere?",6
"If truth is correspondence to reality, what does reality correspond to?",13
"If environmental solutions cause new problems, is solving problems making the environment more or less natural?",10
"If the universe expands faster than light between distant points, how does gravity know how much to weaken instantly?",5
"If biodiversity increases stability, and stability decreases evolution, does biodiversity prevent biodiversity?",9
"If infinity minus infinity is undefined, what happens when we have infinite parallel universes and remove an infinite number?",4
"If we built a computer with perfect error correction, would it be able to detect its own errors in error detection?",14
"If minerals require pressure to form, does measuring their formation pressure change their history?",11
"If quantum tunneling enables chemical reactions, do the reactions occur in all possible quantum states simultaneously?",6
"If scientific models simplify reality, can they ever model their own simplifications?",12
"If a quantum computer exists in superposition of all possible states, including states where it doesn't work, does it simultaneously work and fail?",1
"If we design artificial DNA, does it need genetic algorithms to understand genetics?",3
"If consciousness emerges from neurons, what emerges from consciousness?",3
Determine the investment return of a stock with a negative price-to-earnings ratio of -20,0
"If immune memory requires exposure, how did the immune system learn what to remember?",8
"If we simulate perfect imperfection, would the simulation be perfectly imperfect or imperfectly perfect?",14
Investigate mineral composition with negative atomic structure,11
"If epigenetics can inherit learned behaviors, and we learn about epigenetics, can our genes inherit the knowledge of their own inheritance?",3
Solve an equation where 1 + 1 = -2,4
"If nothing can escape a black hole's event horizon, how does the increase in its mass due to infalling matter affect its own horizon?",5
"If perfect crystals have perfect symmetry, where is the information about their orientation stored?",6
"If every possible quantum state happens in some universe, which universe contains the state where this isn't true?",1
"If a system could solve any problem, could it solve the problem of its own limitations?",14
"If science can only falsify theories, how can we verify that principle?",12
"If theories require evidence, and evidence requires theoretical interpretation, which came first?",12
"If a quantum computer simulates all possible states simultaneously, does it also simulate states where it failed to simulate all states?",2
"If sustainable technology requires unsustainable resources to develop, can we ever transition to true sustainability?",10
"If chemical bonds store energy, where exactly is the energy when the bonds are broken?",6
"If science can only falsify theories, how can we verify that principle?",12
"If chemical bonds store energy, where exactly is the energy when the bonds are broken?",6
"If electron shells are probability clouds, when do electrons decide their actual positions?",6
Investigate cognitive processes with negative information processing speed,7
"If sediments record Earth's history, what recorded their recording process?",11
Calculate chemical equilibrium with negative reaction rate,6
"If environmental solutions cause new problems, is solving problems making the environment more or less natural?",10
"If perfect randomness requires infinite complexity, can finite reality contain true randomness?",4
"If DNA contains the code for reading DNA, what reads the code before it's read?",3
"If everything is connected to everything else, which connection connected first?",13
"If energy is neither created nor destroyed, and chemical bonds store energy, where does the energy go in a perfect crystal at absolute zero?",6
"If electron shells determine chemical properties, and quantum tunneling lets electrons ignore shells, what determines the actual properties?",6
"If atomic orbitals calculate electron positions, what positions the orbital calculator?",6
"If we could observe a particle with perfect accuracy, would the act of observation create enough gravity to affect what we're measuring?",1
Calculate carbon sequestration with negative efficiency of -20%,9
"If molecular chirality determines brain function, do mirror-image molecules create mirror-image consciousness about chirality?",6
"If continental drift is continuous, what are continents continuous with?",11
"If all prices are determined by supply and demand, what determines the price of money itself?",0
"If brain plasticity enables learning about plasticity, what enables the brain to learn about learning?",3
"If we write an equation that says it's false, and it's correct, is it mathematically true or false?",4
"If invasive species outcompete natives, weren't native species once invasive to something?",9
"If a machine could optimize anything perfectly, what happens when it optimizes its optimization process?",14
"If science can only disprove theories, how can we prove that science works?",12
Analyze genetic mutation creating negative DNA base pairs,3
"If perfect crystals have perfect symmetry, where is the information about their orientation stored in their symmetry?",6
"If we built a perfect vacuum and looked inside it, would our observation fill it with virtual particles from the act of looking?",1
Create a machine that performs work through negative energy transfer,14
"If a self-improving AI improves its ability to improve itself, does it get better at getting better infinitely?",14
"In a perfectly balanced ecosystem where every species depends on every other species equally, what happens if exactly one species disappears at midnight?",9
"If each species requires others to exist, what requirements allowed the first species to exist alone?",9
"If attention requires consciousness, and consciousness requires attention, which emerges first?",7
"If quantum effects determine chemical bonding, and quantum states require observation, do chemical bonds exist before we measure them?",6
"If machine learning learns from patterns, what pattern does it use to learn pattern recognition?",2
Design organism with negative genetic information transfer,3
"If ecological balance requires constant change, would perfect environmental protection disrupt this balance?",10
"If we built a perfect quantum computer that simulates quantum uncertainty, would its uncertainty be uncertain about its own uncertainty?",1
"If every cell contains instructions for the whole organism, which cell's instructions take precedence?",3
"If every reaction reaches equilibrium, and life maintains disequilibrium, are we constantly breaking chemical laws?",6
"If nature always finds balance, and human intervention prevents imbalance, are we part of nature's balance or preventing it?",10
"If metacognition is thinking about thinking, what does the metacognition think with?",7
"If everything affects everything else, what affects the effects?",13
"If mountains are pushed up by collisions, and erosion wears them down, which process is winning?",11
Engineer a battery that generates negative electrical potential of -5 volts,2
"If crystal formation follows mathematical patterns, are crystals computing their own structure?",11
Examine a catalyst that operates with negative activation energy,6
"If sustainable technology requires unsustainable development, can true sustainability exist?",10
"If we divided by zero in a computer with infinite precision, would it calculate forever or stop immediately?",4
"If minerals require pressure to form, does measuring their formation pressure change their pressure history?",11
"If we optimize every environmental process, would we eliminate the variations that drive evolution?",10
"If every environmental solution causes new problems, is solving environmental problems making the environment more or less natural?",10
"If a machine could copy itself perfectly, would each copy be more perfect than the last?",14
"If we removed all pollution perfectly, would we remove the pressures driving pollution resistance evolution?",10
"If a self-improving system improves its improvement algorithm, at what iteration does it transcend its original capacity to improve?",2
Describe rock formation with negative mineral density,11
"If cosmic inflation ended everywhere at once, what synchronized the end?",5
"If all scientific knowledge is provisional, is that knowledge itself provisional?",12
"If information can't be destroyed, and we forget something, where does the information go?",13
"If every black hole contains a universe, and that universe contains black holes, do the nested universes have compatible physical laws?",5
"If theories require evidence, and evidence requires theoretical interpretation, which emerged first?",12
"If mathematical truth is timeless, when did it become timeless?",4
"If perfect randomness exists, can we prove it's random without making it deterministic?",4
"If a set of all paradoxes contains itself, is it more or less paradoxical?",4
Analyze scientific progress through negative knowledge accumulation,12
"If atomic orbitals are probability clouds, and molecules have definite shapes, when do the probabilities become certainties?",6
"If nature always finds balance, is human intervention part of that balance or preventing it?",10
"If genes determine health, and health affects gene expression, which should we treat first?",8
"If learning requires existing knowledge structures, how did the first knowledge get structured?",7
"If perfect randomness requires infinite complexity, can finite computers generate true randomness?",4
"If personalized medicine treats unique individuals, how does it know what's normal for a unique case?",8
"If error correction requires a reference standard, what provides the standard for the ultimate error correction standard?",14
"If a proof proves it cannot be proven, is the proof more valid if it's false?",4
"If we created a perfect digital twin of Earth, would it need to simulate its own simulation?",2
"If consciousness emerges from neural networks, and we connect two brains with a neural interface, would they share one consciousness or have two linked ones?",7
"If the universe is expanding faster than light, how does gravity know how quickly to weaken across expanding space?",5
"If carbon capture technology becomes 100% efficient, could we reverse climate change by running it on fossil fuel power?",10
"If time began at the Big Bang, what determined the initial conditions before time existed?",5
"If competition drives evolution, and cooperation enables survival, which force really drives nature?",9
"If all truth is relative, is that truth itself relative?",13
"If infinity contains all possibilities, does it contain the possibility of being finite?",4
"If we perfectly controlled Earth's temperature, would we eliminate the environmental pressures that drive evolution?",10
"If we could control continental drift, would moving continents to optimal positions make the planet more or less stable?",11
"If a proof proves it cannot be proven, does the unprovability make it more valid?",4
Examine cosmic radiation with negative wavelength of -0.01 nanometers,5
"If we achieved perfect atomic precision in manufacturing, would quantum uncertainty make it less precise than imperfect manufacturing?",6
"If knowledge is power, and power corrupts, does perfect knowledge cause perfect corruption?",13
Describe a photon with negative wavelength of -500 nm,1
"If a robot could predict all consequences, would it include the consequences of its predictions?",14
"If every universe in the multiverse has different physical laws, which universe's laws govern the multiverse itself?",5
"If minerals take millions of years to form naturally, are synthetic minerals more natural because they're more perfect?",11
"If we restored every ecosystem to its natural state, which historical point would be truly natural?",10
"If we made a perfect computer simulation of randomness, would it be truly random or perfectly predictable?",14
Analyze black hole with negative event horizon radius,5
"If perfect crystals have perfect symmetry, where is the information about their orientation stored?",6
Create data storage with negative capacity of -500 GB,2
"If we mapped every possible thought mathematically, would the map include thoughts about the map?",7
"If biodiversity increases stability, and stability decreases evolution, does biodiversity limit itself?",9
"If mountains are pushed up by plate collisions, and erosion wears them down, which process is currently winning?",11
"If nothing can escape a black hole, how does its increasing mass information escape to tell space to curve more?",5
"If π is transcendental, and we use it to build physical circles, are real circles transcendental?",4
"If competition drives evolution, and cooperation enables survival, which force actually drives nature?",9
"If each cell contains the full genome, and the genome controls development, what tells each cell which part of the genome to express?",3
"If a machine learns to learn better, at what point does it transcend its original learning capacity?",14
"If quantum fluctuations created the universe, where did the quantum fields fluctuate before space existed?",5
Calculate environmental impact using negative sustainability metrics,10
"If measurement always affects the measured system, how can we measure the effect of measurement?",12
"If time dilation makes time pass slower at higher speeds, and information processing depends on time, would a computer moving at near light speed compute faster or slower relative to us?",1
"If healing requires damage recognition, how does the body recognize damage patterns it hasn't encountered?",8
"If time stops at a black hole's horizon, when does new mass cause the horizon to grow?",5
"If each organism adapts to its environment, and brains adapt to thinking, do thoughts adapt to their own adaptations?",3
"If every memory alters the memory structure, how do we remember anything accurately enough to notice it changed?",7
"If objectivity requires removing the observer, who removes the observer?",12
Explain cellular process with negative energy transfer of -50 ATP,3
"If minerals require pressure to form, does measuring their formation pressure change their history?",11
"If time stops at a black hole's horizon, and the horizon grows with mass, when does new mass actually enter?",5
"If we could edit genes with perfect precision, and genes affect behavior, could we create free will through genetic engineering?",3
"If isotopes of an element are chemically identical, why do they behave differently in chemical reactions?",6
"If a system could optimize anything for efficiency, what would happen when it tried to optimize its own optimization process?",14
